id,group,order,family,genus,binomial,english,domesticated species,notes,Source1,Antelopes,Artiodactyla,Bovidae,Aepyceros,Aepyceros melampus,Impala,,,FAO World Watch List 2,Antelopes,Artiodactyla,Bovidae,Antidorcas,Antidorcas marsupialis,Springbok,,,FAO World Watch List 3,Antelopes,Artiodactyla,Bovidae,Antilope,Antilope cervicapra,Blackbuck,,,FAO World Watch List 4,Antelopes,Artiodactyla,Bovidae,Boselephas,Boselephas tragocamelus,Nilgai,,,FAO World Watch List 5,Antelopes,Artiodactyla,Bovidae,Cephalophus,Cephalophus adersi,Aders' Duiker,,,FAO World Watch List all Cephalophus spp. from RL6,Antelopes,Artiodactyla,Bovidae,Cephalophus,Cephalophus callipygus,Peters' Duiker,,,FAO World Watch List all Cephalophus spp. from RL7,Antelopes,Artiodactyla,Bovidae,Cephalophus,Cephalophus dorsalis,Bay Duiker,,,FAO World Watch List all Cephalophus spp. from RL8,Antelopes,Artiodactyla,Bovidae,Cephalophus,Cephalophus harveyi,Harvey's Duiker,,,FAO World Watch List all Cephalophus spp. from RL9,Antelopes,Artiodactyla,Bovidae,Cephalophus,Cephalophus jentinki,Jentink's Duiker,,,FAO World Watch List all Cephalophus spp. from RL10,Antelopes,Artiodactyla,Bovidae,Cephalophus,Cephalophus leucogaster,White-bellied Duiker,,,FAO World Watch List all Cephalophus spp. from RL11,Antelopes,Artiodactyla,Bovidae,Cephalophus,Cephalophus natalensis,Natal Red Duiker,,,FAO World Watch List all Cephalophus spp. from RL12,Antelopes,Artiodactyla,Bovidae,Cephalophus,Cephalophus niger,Black Duiker,,,FAO World Watch List all Cephalophus spp. from RL13,Antelopes,Artiodactyla,Bovidae,Cephalophus,Cephalophus nigrifrons,Black-fronted Duiker,,,FAO World Watch List all Cephalophus spp. from RL14,Antelopes,Artiodactyla,Bovidae,Cephalophus,Cephalophus ogilbyi,Ogilby's Duiker,,,FAO World Watch List all Cephalophus spp. from RL15,Antelopes,Artiodactyla,Bovidae,Cephalophus,Cephalophus rufilatus,Red-flanked Duiker,,,FAO World Watch List all Cephalophus spp. from RL16,Antelopes,Artiodactyla,Bovidae,Cephalophus,Cephalophus silvicultor,Yellow-backed Duiker,,,FAO World Watch List all Cephalophus spp. from RL17,Antelopes,Artiodactyla,Bovidae,Cephalophus,Cephalophus spadix,Abbott's Duiker,,,FAO World Watch List all Cephalophus spp. from RL18,Antelopes,Artiodactyla,Bovidae,Cephalophus,Cephalophus weynsi,Weyns' Duiker,,,FAO World Watch List all Cephalophus spp. from RL19,Antelopes,Artiodactyla,Bovidae,Cephalophus,Cephalophus zebra,Zebra Duiker,,,FAO World Watch List all Cephalophus spp. from RL20,Antelopes,Artiodactyla,Bovidae,Cephalophus,Sylvicapra grimmia,Common duiker,,,FAO World Watch List all Sylvicapra spp. from RL21,Antelopes,Artiodactyla,Bovidae,Oryx,Oryx beisa,Beisa oryx,,includes subsp. O. b. callotus,FAO World Watch List 22,Antelopes,Artiodactyla,Bovidae,Oryx,Oryx gazella,Gemsbok,,,FAO World Watch List 23,Antelopes,Artiodactyla,Bovidae,Saiga,Saiga tartarica,Mongolian Saiga,,,FAO World Watch List 24,Antelopes,Artiodactyla,Bovidae,Tragelaphus,Tragelaphus oryx,Common eland,,syn. Taurotragus oryx,FAO World Watch List 25,Bears,Carnivora,Ursidae,Ursus,Ursus arctos,Brown bear,,,FAO World Watch List 26,Bears,Carnivora,Ursidae,Ursus,Ursus thibetanus,Asiatic black bear,,,FAO World Watch List 27,Birds,Anseriformes,Anatidae,Anas,Anas platyrhynchos,Mallard,,,FAO World Watch List 28,Birds,Anseriformes,Anatidae,Anser,Anser anser,Greylag goose,,,FAO World Watch List 29,Birds,Anseriformes,Anatidae,Anser,Anser cygnoides,Swan goose,,,FAO World Watch List 30,Birds,Anseriformes,Anatidae,Anser,Anser indicus,BAR-HEADED GOOSE,,,FAO World Watch List 31,Birds,Anseriformes,Anatidae,Anser,Branta ruficollis,Red-breasted goose,,,FAO World Watch List 32,Birds,Anseriformes,Anatidae,Anser,Branta sandvicensis,Ne-ne,,,FAO World Watch List 33,Birds,Anseriformes,Anatidae,Anser,Chen caerulescens,Snow goose,,syn. Anser caerulescens,FAO World Watch List 34,Birds,Anseriformes,Anatidae,Cairina,Cairina moschata,Muscovy Duck,,,FAO World Watch List - all Cairina spp.35,Birds,Anseriformes,Anatidae,Cairina,Cairina scutulata,"White-winged Duck, White-winged Wood Duck",,,FAO World Watch List - all Cairina spp.36,Birds,Anseriformes,Anatidae,Dendrocygna,Dendrocygna arborea,"Black-billed Wood-duck, Cuban Tree-duck, West Indian Tree-duck, West Indian Whistling-duck, West Indian Whistling Duck, West Indian Whistling-Duck",,,FAO World Watch List - all Dendrocygna spp.37,Birds,Anseriformes,Anatidae,Dendrocygna,Dendrocygna arcuata,"Wandering Whistling-duck, Wandering Whistling Duck, Wandering Whistling-Duck",,,FAO World Watch List - all Dendrocygna spp.38,Birds,Anseriformes,Anatidae,Dendrocygna,Dendrocygna autumnalis,"Black-bellied Whistling-duck, Black-bellied Whistling Duck, Black-bellied Whistling-Duck",,,FAO World Watch List - all Dendrocygna spp.39,Birds,Anseriformes,Anatidae,Dendrocygna,Dendrocygna bicolor,"Fulvous Duck, Fulvous Whistling-duck, Fulvous Whistling Duck, Fulvous Whistling-Duck",,,FAO World Watch List - all Dendrocygna spp.40,Birds,Anseriformes,Anatidae,Dendrocygna,Dendrocygna eytoni,"Grass Whistling Duck, Plumed Whistling-duck, Plumed Whistling Duck, Plumed Whistling-Duck",,,FAO World Watch List - all Dendrocygna spp.41,Birds,Anseriformes,Anatidae,Dendrocygna,Dendrocygna guttata,"Spotted Whistling-duck, Spotted Whistling Duck, Spotted Whistling-Duck",,,FAO World Watch List - all Dendrocygna spp.42,Birds,Anseriformes,Anatidae,Dendrocygna,Dendrocygna javanica,"Lesser Whistling-duck, Lesser Whistling Duck, Lesser Whistling-Duck",,,FAO World Watch List - all Dendrocygna spp.43,Birds,Anseriformes,Anatidae,Dendrocygna,Dendrocygna viduata,"White-faced Duck, White-faced Whistling-duck, White-faced Whistling Duck, White-faced Whistling-Duck",,,FAO World Watch List - all Dendrocygna spp.44,Birds,Casuariiformes,Dromaiidae,Dromanius,Dromaius novaehollandiae,Emu,,syn. Dromanius novaehollandiae,FAO World Watch List 45,Birds,GALLIFORMES,CRACIDAE,Aburria,Aburria aburri,Wattled Guan,,,McGowan 201046,Birds,GALLIFORMES,CRACIDAE,Chamaepetes,Chamaepetes goudotii,Sickle-winged Guan,,,McGowan 201047,Birds,GALLIFORMES,CRACIDAE,Chamaepetes,Chamaepetes unicolor,Black Guan,,,McGowan 201048,Birds,GALLIFORMES,CRACIDAE,Crax,Crax alberti,"Blue-billed Curassow, Blue-knobbed Curassow",,,McGowan 201049,Birds,GALLIFORMES,CRACIDAE,Crax,Crax alector,Black Curassow,,,McGowan 201050,Birds,GALLIFORMES,CRACIDAE,Crax,Crax blumenbachii,"Mutum, Red-billed Curassow, Red-knobbed Curassow",,,McGowan 201051,Birds,GALLIFORMES,CRACIDAE,Crax,Crax daubentoni,Yellow-knobbed Curassow,,,McGowan 201052,Birds,GALLIFORMES,CRACIDAE,Crax,Crax fasciolata,Bare-faced Curassow,,,McGowan 201053,Birds,GALLIFORMES,CRACIDAE,Crax,Crax globulosa,Wattled Curassow,,,McGowan 201054,Birds,GALLIFORMES,CRACIDAE,Crax,Crax rubra,Great Curassow,,,McGowan 201055,Birds,GALLIFORMES,CRACIDAE,Mitu,Mitu mitu,Alagoas Curassow,,,McGowan 201056,Birds,GALLIFORMES,CRACIDAE,Mitu,Mitu salvini,"Salvin's Curassow, Salvin's Currasow",,,McGowan 201057,Birds,GALLIFORMES,CRACIDAE,Mitu,Mitu tomentosum,Crestless Curassow,,,McGowan 201058,Birds,GALLIFORMES,CRACIDAE,Mitu,Mitu tuberosum,Razor-billed Curassow,,,McGowan 201059,Birds,GALLIFORMES,CRACIDAE,Nothocrax,Nothocrax urumutum,Nocturnal Curassow,,,McGowan 201060,Birds,GALLIFORMES,CRACIDAE,Oreophasis,Oreophasis derbianus,Horned Guan,,,McGowan 201061,Birds,GALLIFORMES,CRACIDAE,Ortalis,Ortalis canicollis,Chaco Chachalaca,,,McGowan 201062,Birds,GALLIFORMES,CRACIDAE,Ortalis,Ortalis cinereiceps,"Gray-headed Chachalaca, Grey-headed Chachalaca",,,McGowan 201063,Birds,GALLIFORMES,CRACIDAE,Ortalis,Ortalis columbiana,Colombian Chachalaca,,,McGowan 201064,Birds,GALLIFORMES,CRACIDAE,Ortalis,Ortalis erythroptera,"Rufous-headed Chachalaca, Rufous Headed Chachalaca",,,McGowan 201065,Birds,GALLIFORMES,CRACIDAE,Ortalis,Ortalis garrula,Chestnut-winged Chachalaca,,,McGowan 201066,Birds,GALLIFORMES,CRACIDAE,Ortalis,Ortalis guttata,Speckled Chachalaca,,,McGowan 201067,Birds,GALLIFORMES,CRACIDAE,Ortalis,Ortalis leucogastra,White-bellied Chachalaca,,,McGowan 201068,Birds,GALLIFORMES,CRACIDAE,Ortalis,Ortalis motmot,"Little Chachalaca, Variable Chachalaca",,,McGowan 201069,Birds,GALLIFORMES,CRACIDAE,Ortalis,Ortalis poliocephala,West Mexican Chachalaca,,,McGowan 201070,Birds,GALLIFORMES,CRACIDAE,Ortalis,Ortalis ruficauda,Rufous-vented Chachalaca,,,McGowan 201071,Birds,GALLIFORMES,CRACIDAE,Ortalis,Ortalis superciliaris,Buff-browed Chachalaca,,,McGowan 201072,Birds,GALLIFORMES,CRACIDAE,Ortalis,Ortalis vetula,Plain Chachalaca,,,McGowan 201073,Birds,GALLIFORMES,CRACIDAE,Ortalis,Ortalis wagleri,Rufous-bellied Chachalaca,,,McGowan 201074,Birds,GALLIFORMES,CRACIDAE,Pauxi,Pauxi pauxi,"Helmeted Curassow, Northern Helmeted Curassow",,,McGowan 201075,Birds,GALLIFORMES,CRACIDAE,Pauxi,Pauxi unicornis,"Horned Curassow, Southern Helmeted Curassow",,,McGowan 201076,Birds,GALLIFORMES,CRACIDAE,Penelope,Penelope albipennis,White-winged Guan,,,McGowan 201077,Birds,GALLIFORMES,CRACIDAE,Penelope,Penelope argyrotis,Band-tailed Guan,,,McGowan 201078,Birds,GALLIFORMES,CRACIDAE,Penelope,Penelope barbata,Bearded Guan,,,McGowan 201079,Birds,GALLIFORMES,CRACIDAE,Penelope,Penelope dabbenei,Red-faced Guan,,,McGowan 201080,Birds,GALLIFORMES,CRACIDAE,Penelope,Penelope jacquacu,Spix's Guan,,,McGowan 201081,Birds,GALLIFORMES,CRACIDAE,Penelope,Penelope jacucaca,White-browed Guan,,,McGowan 201082,Birds,GALLIFORMES,CRACIDAE,Penelope,Penelope marail,Marail Guan,,,McGowan 201083,Birds,GALLIFORMES,CRACIDAE,Penelope,Penelope montagnii,Andean Guan,,,McGowan 201084,Birds,GALLIFORMES,CRACIDAE,Penelope,Penelope obscura,Dusky-legged Guan,,,McGowan 201085,Birds,GALLIFORMES,CRACIDAE,Penelope,Penelope ochrogaster,Chestnut-bellied Guan,,,McGowan 201086,Birds,GALLIFORMES,CRACIDAE,Penelope,Penelope ortoni,"Baudo Guan, Baudï¿½ Guan",,,McGowan 201087,Birds,GALLIFORMES,CRACIDAE,Penelope,Penelope perspicax,Cauca Guan,,,McGowan 201088,Birds,GALLIFORMES,CRACIDAE,Penelope,Penelope pileata,White-crested Guan,,,McGowan 201089,Birds,GALLIFORMES,CRACIDAE,Penelope,Penelope purpurascens,Crested Guan,,,McGowan 201090,Birds,GALLIFORMES,CRACIDAE,Penelope,Penelope superciliaris,Rusty-margined Guan,,,McGowan 201091,Birds,GALLIFORMES,CRACIDAE,Penelopina,Penelopina nigra,Highland Guan,,,McGowan 201092,Birds,GALLIFORMES,CRACIDAE,Pipile,Pipile cujubi,"Red-throated Piping-guan, Red-throated Piping-Guan",,,McGowan 201093,Birds,GALLIFORMES,CRACIDAE,Pipile,Pipile cumanensis,"Blue-throated Piping-guan, Blue-throated Piping-Guan",,,McGowan 201094,Birds,GALLIFORMES,CRACIDAE,Pipile,Pipile jacutinga,"Black Fronted Curassow, Black-fronted Piping-guan, Black-fronted Piping Guan, Black-fronted Piping-Guan",,,McGowan 201095,Birds,GALLIFORMES,CRACIDAE,Pipile,Pipile pipile,"Common Piping Guan, Trinidad Piping-guan, Trinidad Piping-Guan, Trinidad White-headed Curassow, Trinidad White-headed Piping Guan",,,McGowan 201096,Birds,Galliformes,Galliformidae,Gallus,Gallus gallus,Red Junglefowl,,,FAO World Watch List - all Gallus spp.97,Birds,Galliformes,Galliformidae,Gallus,Gallus lafayetii,"Ceylon Junglefowl, Sri Lanka Junglefowl",,,FAO World Watch List - all Gallus spp.98,Birds,Galliformes,Galliformidae,Gallus,Gallus sonneratii,"Grey Junglefowl, Sonnerat's Junglefowl",,,FAO World Watch List - all Gallus spp.99,Birds,Galliformes,Galliformidae,Gallus,Gallus varius,Green Junglefowl,,,FAO World Watch List - all Gallus spp.100,Birds,GALLIFORMES,MEGAPODIIDAE,Aepypodius,Aepypodius arfakianus,"Wattled Brushturkey, Wattled Brush-turkey",,,McGowan 2010101,Birds,GALLIFORMES,MEGAPODIIDAE,Aepypodius,Aepypodius bruijnii,"Bruijn's Brush-turkey, Waigeo Brushturkey, Waigeo Brush-turkey",,,McGowan 2010102,Birds,GALLIFORMES,MEGAPODIIDAE,Alectura,Alectura lathami,"Australian Brushturkey, Australian Brush-turkey",,,McGowan 2010103,Birds,GALLIFORMES,MEGAPODIIDAE,Eulipoa,Eulipoa wallacei,"Moluccan Megapode, Moluccan Scrubfowl",,,McGowan 2010104,Birds,GALLIFORMES,MEGAPODIIDAE,Leipoa,Leipoa ocellata,Malleefowl,,,McGowan 2010105,Birds,GALLIFORMES,MEGAPODIIDAE,Macrocephalon,Macrocephalon maleo,"Gray's Brush-turkey, Maleo, Maleo Megapode",,,McGowan 2010106,Birds,GALLIFORMES,MEGAPODIIDAE,Megapodius,Megapodius affinis,"New Guinea Megapode, New Guinea Scrubfowl",,,McGowan 2010107,Birds,GALLIFORMES,MEGAPODIIDAE,Megapodius,Megapodius bernsteinii,"Sula Megapode, Sula Scrubfowl",,,McGowan 2010108,Birds,GALLIFORMES,MEGAPODIIDAE,Megapodius,Megapodius cumingii,"Philippine Megapode, Tabon Megapode, Tabon Scrubfowl",,,McGowan 2010109,Birds,GALLIFORMES,MEGAPODIIDAE,Megapodius,Megapodius eremita,"Melanesian Megapode, Melanesian Scrubfowl",,,McGowan 2010110,Birds,GALLIFORMES,MEGAPODIIDAE,Megapodius,Megapodius freycinet,Dusky Megapode,,,McGowan 2010111,Birds,GALLIFORMES,MEGAPODIIDAE,Megapodius,Megapodius geelvinkianus,Biak Megapode,,,McGowan 2010112,Birds,GALLIFORMES,MEGAPODIIDAE,Megapodius,Megapodius laperouse,"Marianas Scrubfowl, Micronesian Megapode, Micronesian Scrubfowl",,,McGowan 2010113,Birds,GALLIFORMES,MEGAPODIIDAE,Megapodius,Megapodius layardi,"New Hebrides Scrubfowl, Vanuatu Megapode, Vanuatu Scrubfowl",,,McGowan 2010114,Birds,GALLIFORMES,MEGAPODIIDAE,Megapodius,Megapodius nicobariensis,"Nicobar Megapode, Nicobar Scrubfowl",,,McGowan 2010115,Birds,GALLIFORMES,MEGAPODIIDAE,Megapodius,Megapodius pritchardii,"Nevafou Megapode, Niaufoou Scrubfowl, Polynesian Megapode, Polynesian Scrubfowl, Tongan Megapode",,,McGowan 2010116,Birds,GALLIFORMES,MEGAPODIIDAE,Megapodius,Megapodius reinwardt,"Orange-footed Megapode, Orange-footed Scrubfowl, Scrubfowl",,,McGowan 2010117,Birds,GALLIFORMES,MEGAPODIIDAE,Megapodius,Megapodius tenimberensis,Tanimbar Megapode,,,McGowan 2010118,Birds,GALLIFORMES,MEGAPODIIDAE,Talegalla,Talegalla cuvieri,"Red-billed Brushturkey, Red-billed Brush-turkey",,,McGowan 2010119,Birds,GALLIFORMES,MEGAPODIIDAE,Talegalla,Talegalla fuscirostris,"Black-billed Brushturkey, Black-billed Brush-turkey",,,McGowan 2010120,Birds,GALLIFORMES,MEGAPODIIDAE,Talegalla,Talegalla jobiensis,"Brown-collared Brush-turkey, Collared Brushturkey",,,McGowan 2010121,Birds,GALLIFORMES,NUMIDIDAE,Agelastes,Agelastes meleagrides,White-breasted Guineafowl,,,McGowan 2010122,Birds,GALLIFORMES,NUMIDIDAE,Agelastes,Agelastes niger,Black Guineafowl,,,McGowan 2010123,Birds,GALLIFORMES,NUMIDIDAE,Guttera,Guttera plumifera,Plumed Guineafowl,,,McGowan 2010124,Birds,GALLIFORMES,NUMIDIDAE,Guttera,Guttera pucherani,Crested Guineafowl,,,McGowan 2010125,Birds,GALLIFORMES,ODONTOPHORIDAE,Callipepla,Callipepla californica,California Quail,,,McGowan 2010126,Birds,GALLIFORMES,ODONTOPHORIDAE,Callipepla,Callipepla douglasii,Elegant Quail,,,McGowan 2010127,Birds,GALLIFORMES,ODONTOPHORIDAE,Callipepla,Callipepla gambelii,Gambel's Quail,,,McGowan 2010128,Birds,GALLIFORMES,ODONTOPHORIDAE,Callipepla,Callipepla squamata,Scaled Quail,,,McGowan 2010129,Birds,GALLIFORMES,ODONTOPHORIDAE,Colinus,Colinus cristatus,Crested Bobwhite,,,McGowan 2010130,Birds,GALLIFORMES,ODONTOPHORIDAE,Colinus,Colinus nigrogularis,"Black-throated Bobwhite, Yucatan Bobwhite",,,McGowan 2010131,Birds,GALLIFORMES,ODONTOPHORIDAE,Colinus,Colinus virginianus,"Bobwhite, Bobwhite Quail, Northern Bobwhite",,,McGowan 2010132,Birds,GALLIFORMES,ODONTOPHORIDAE,Cyrtonyx,Cyrtonyx montezumae,Montezuma Quail,,,McGowan 2010133,Birds,GALLIFORMES,ODONTOPHORIDAE,Cyrtonyx,Cyrtonyx ocellatus,Ocellated Quail,,,McGowan 2010134,Birds,GALLIFORMES,ODONTOPHORIDAE,Dactylortyx,Dactylortyx thoracicus,Singing Quail,,,McGowan 2010135,Birds,GALLIFORMES,ODONTOPHORIDAE,Dendrortyx,Dendrortyx barbatus,"Bearded Wood-partridge, Bearded Wood Partridge, Bearded Wood-Partridge",,,McGowan 2010136,Birds,GALLIFORMES,ODONTOPHORIDAE,Dendrortyx,Dendrortyx leucophrys,"Buffy-crowned Wood-partridge, Buffy-crowned Wood Partridge, Buffy-crowned Wood-Partridge",,,McGowan 2010137,Birds,GALLIFORMES,ODONTOPHORIDAE,Dendrortyx,Dendrortyx macroura,"Long-tailed Wood-partridge, Long-tailed Wood Partridge, Long-tailed Wood-Partridge",,,McGowan 2010138,Birds,GALLIFORMES,ODONTOPHORIDAE,Odontophorus,Odontophorus atrifrons,"Black-fronted Wood-quail, Black-fronted Wood Quail, Black-fronted Wood-Quail",,,McGowan 2010139,Birds,GALLIFORMES,ODONTOPHORIDAE,Odontophorus,Odontophorus balliviani,"Stripe-faced Wood-quail, Stripe-faced Wood Quail, Stripe-faced Wood-Quail",,,McGowan 2010140,Birds,GALLIFORMES,ODONTOPHORIDAE,Odontophorus,Odontophorus capueira,"Spot-winged Wood-quail, Spot-winged Wood Quail, Spot-winged Wood-Quail",,,McGowan 2010141,Birds,GALLIFORMES,ODONTOPHORIDAE,Odontophorus,Odontophorus columbianus,"Venezuelan Wood-quail, Venezuelan Wood Quail, Venezuelan Wood-Quail",,,McGowan 2010142,Birds,GALLIFORMES,ODONTOPHORIDAE,Odontophorus,Odontophorus dialeucos,"Tacarcuna Wood-quail, Tacarcuna Wood Quail, Tacarcuna Wood-Quail",,,McGowan 2010143,Birds,GALLIFORMES,ODONTOPHORIDAE,Odontophorus,Odontophorus erythrops,"Rufous-fronted Wood-quail, Rufous-fronted Wood Quail, Rufous-fronted Wood-Quail",,,McGowan 2010144,Birds,GALLIFORMES,ODONTOPHORIDAE,Odontophorus,Odontophorus gujanensis,"Marbled Wood-quail, Marbled Wood Quail, Marbled Wood-Quail",,,McGowan 2010145,Birds,GALLIFORMES,ODONTOPHORIDAE,Odontophorus,Odontophorus guttatus,"Spotted Wood-quail, Spotted Wood Quail, Spotted Wood-Quail",,,McGowan 2010146,Birds,GALLIFORMES,ODONTOPHORIDAE,Odontophorus,Odontophorus hyperythrus,"Chestnut Wood-quail, Chestnut Wood Quail, Chestnut Wood-Quail",,,McGowan 2010147,Birds,GALLIFORMES,ODONTOPHORIDAE,Odontophorus,Odontophorus leucolaemus,"Black-breasted Wood-quail, Black-breasted Wood Quail, Black-breasted Wood-Quail",,,McGowan 2010148,Birds,GALLIFORMES,ODONTOPHORIDAE,Odontophorus,Odontophorus melanonotus,"Dark-backed Wood-quail, Dark-backed Wood Quail, Dark-backed Wood-Quail",,,McGowan 2010149,Birds,GALLIFORMES,ODONTOPHORIDAE,Odontophorus,Odontophorus melanotis,"Black-eared Wood-quail, Black-eared Wood Quail, Black-eared Wood-Quail",,,McGowan 2010150,Birds,GALLIFORMES,ODONTOPHORIDAE,Odontophorus,Odontophorus speciosus,"Rufous-breasted Wood-quail, Rufous-breasted Wood Quail, Rufous-breasted Wood-Quail",,,McGowan 2010151,Birds,GALLIFORMES,ODONTOPHORIDAE,Odontophorus,Odontophorus stellatus,"Starred Wood-quail, Starred Wood Quail, Starred Wood-Quail",,,McGowan 2010152,Birds,GALLIFORMES,ODONTOPHORIDAE,Odontophorus,Odontophorus strophium,"Gorgeted Wood-quail, Gorgeted Wood Quail, Gorgeted Wood-Quail",,,McGowan 2010153,Birds,GALLIFORMES,ODONTOPHORIDAE,Oreortyx,Oreortyx pictus,Mountain Quail,,,McGowan 2010154,Birds,GALLIFORMES,ODONTOPHORIDAE,Philortyx,Philortyx fasciatus,Banded Quail,,,McGowan 2010155,Birds,GALLIFORMES,ODONTOPHORIDAE,Rhynchortyx,Rhynchortyx cinctus,Tawny-faced Quail,,,McGowan 2010156,Birds,Galliformes,Phasianidae,Acryllium,Acryllium vulturinum,Vulturine Guineafowl,,,FAO World Watch List 157,Birds,Galliformes,Phasianidae,Afropavo,Afropavo congensis,"Congo Peacock, Congo Peafowl",,,McGowan 2010158,Birds,Galliformes,Phasianidae,Alectoris,Alectoris barbara,Barbary Partridge,,,McGowan 2010159,Birds,Galliformes,Phasianidae,Alectoris,Alectoris chukar,"Chuckar, Chukar, Chukar Partridge",,,McGowan 2010160,Birds,Galliformes,Phasianidae,Alectoris,Alectoris graeca,Rock Partridge,,,McGowan 2010161,Birds,Galliformes,Phasianidae,Alectoris,Alectoris magna,"Przevalski's Partridge, Rusty-necklaced Partridge",,,McGowan 2010162,Birds,Galliformes,Phasianidae,Alectoris,Alectoris melanocephala,"Arabian Partridge, Arabian Red-legged Partridge",,,McGowan 2010163,Birds,Galliformes,Phasianidae,Alectoris,Alectoris philbyi,"Philby's Partridge, Philby's Rock Partridge",,,McGowan 2010164,Birds,Galliformes,Phasianidae,Alectoris,Alectoris rufa,Red-legged Partridge,,,McGowan 2010165,Birds,Galliformes,Phasianidae,Ammoperdix,Ammoperdix griseogularis,"See-see, See-see Partridge, See-See Partridge",,,McGowan 2010166,Birds,Galliformes,Phasianidae,Ammoperdix,Ammoperdix heyi,Sand Partridge,,,McGowan 2010167,Birds,Galliformes,Phasianidae,Anurophasis,Anurophasis monorthonyx,"Snow Mountain Quail, Snow Mountains Quail",,,McGowan 2010168,Birds,Galliformes,Phasianidae,Arborophila,Arborophila ardens,"Hainan Partridge, White-eared Hill-partridge, White-eared Partridge",,,McGowan 2010169,Birds,Galliformes,Phasianidae,Arborophila,Arborophila atrogularis,White-cheeked Partridge,,,McGowan 2010170,Birds,Galliformes,Phasianidae,Arborophila,Arborophila brunneopectus,Bar-backed Partridge,,,McGowan 2010171,Birds,Galliformes,Phasianidae,Arborophila,Arborophila cambodiana,Chestnut-headed Partridge,,,McGowan 2010172,Birds,Galliformes,Phasianidae,Arborophila,Arborophila campbelli,Malaysian Partridge,,,McGowan 2010173,Birds,Galliformes,Phasianidae,Arborophila,Arborophila charltonii,"Chestnut-breasted Tree-partridge, Chestnut-necklaced Partridge, Scaly-breasted Partridge",,,McGowan 2010174,Birds,Galliformes,Phasianidae,Arborophila,Arborophila chloropus,"Green-legged Partridge, Scaly-breasted Partridge",,,McGowan 2010175,Birds,Galliformes,Phasianidae,Arborophila,Arborophila crudigularis,Taiwan Partridge,,,McGowan 2010176,Birds,Galliformes,Phasianidae,Arborophila,Arborophila davidi,Orange-necked Partridge,,,McGowan 2010177,Birds,Galliformes,Phasianidae,Arborophila,Arborophila gingica,"Rickett's Hill-partridge, White-necklaced Partridge",,,McGowan 2010178,Birds,Galliformes,Phasianidae,Arborophila,Arborophila hyperythra,Red-breasted Partridge,,,McGowan 2010179,Birds,Galliformes,Phasianidae,Arborophila,Arborophila javanica,Chestnut-bellied Partridge,,,McGowan 2010180,Birds,Galliformes,Phasianidae,Arborophila,Arborophila mandellii,Chestnut-breasted Partridge,,,McGowan 2010181,Birds,Galliformes,Phasianidae,Arborophila,Arborophila orientalis,"Grey-breasted Partridge, White-faced Partridge",,,McGowan 2010182,Birds,Galliformes,Phasianidae,Arborophila,Arborophila rolli,Roll's Partridge,,,McGowan 2010183,Birds,Galliformes,Phasianidae,Arborophila,Arborophila rubrirostris,Red-billed Partridge,,,McGowan 2010184,Birds,Galliformes,Phasianidae,Arborophila,Arborophila rufipectus,Sichuan Partridge,,,McGowan 2010185,Birds,Galliformes,Phasianidae,Arborophila,Arborophila rufogularis,Rufous-throated Partridge,,,McGowan 2010186,Birds,Galliformes,Phasianidae,Arborophila,Arborophila sumatrana,"Grey-breasted Partridge, Sumatran Partridge",,,McGowan 2010187,Birds,Galliformes,Phasianidae,Arborophila,Arborophila torqueola,Hill Partridge,,,McGowan 2010188,Birds,Galliformes,Phasianidae,Argusianus,Argusianus argus,Great Argus,,,McGowan 2010189,Birds,Galliformes,Phasianidae,Argusianus,Argusianus bipunctatus,Double-banded Argus,,,McGowan 2010190,Birds,Galliformes,Phasianidae,Bambusicola,Bambusicola fytchii,"Mountain Bamboo-partridge, Mountain Bamboo Partridge, Mountain Bamboo-Partridge",,,McGowan 2010191,Birds,Galliformes,Phasianidae,Bambusicola,Bambusicola thoracicus,"Chinese Bamboo-partridge, Chinese Bamboo Partridge, Chinese Bamboo-Partridge",,,McGowan 2010192,Birds,Galliformes,Phasianidae,Bonasa,Bonasa bonasia,Hazel Grouse,,,McGowan 2010193,Birds,Galliformes,Phasianidae,Bonasa,Bonasa sewerzowi,Chinese Grouse,,,McGowan 2010194,Birds,Galliformes,Phasianidae,Bonasa,Bonasa umbellus,Ruffed Grouse,,,McGowan 2010195,Birds,Galliformes,Phasianidae,Caloperdix,Caloperdix oculeus,Ferruginous Partridge,,,McGowan 2010196,Birds,Galliformes,Phasianidae,Catreus,Catreus wallichi,"Cheer Pheasant, Chir Pheasant, Wallich's Pheasant",,,McGowan 2010197,Birds,Galliformes,Phasianidae,Centrocercus,Centrocercus minimus,"Gunnison Grouse, Gunnison Sage-grouse, Gunnison Sage Grouse, Gunnison Sage-Grouse",,,McGowan 2010198,Birds,Galliformes,Phasianidae,Centrocercus,Centrocercus urophasianus,"Greater Sage-grouse, Greater Sage Grouse, Greater Sage-Grouse, Sage Grouse",,,McGowan 2010199,Birds,Galliformes,Phasianidae,Chrysolophus,Chrysolophus amherstiae,Lady Amherst's Pheasant,,,McGowan 2010200,Birds,Galliformes,Phasianidae,Chrysolophus,Chrysolophus pictus,Golden Pheasant,,,McGowan 2010201,Birds,Galliformes,Phasianidae,Coturnix,Coturnix chinensis,"Blue Quail, King Quail",,,McGowan 2010202,Birds,Galliformes,Phasianidae,Coturnix,Coturnix coromandelica,Rain Quail,,,McGowan 2010203,Birds,Galliformes,Phasianidae,Coturnix,Coturnix coturnix,"Common Quail, Quail",,,McGowan 2010204,Birds,Galliformes,Phasianidae,Coturnix,Coturnix delegorguei,Harlequin Quail,,,McGowan 2010205,Birds,Galliformes,Phasianidae,Coturnix,Coturnix japonica,Japanese Quail,,,McGowan 2010206,Birds,Galliformes,Phasianidae,Coturnix,Coturnix novaezelandiae,New Zealand Quail,,,McGowan 2010207,Birds,Galliformes,Phasianidae,Coturnix,Coturnix pectoralis,Stubble Quail,,,McGowan 2010208,Birds,Galliformes,Phasianidae,Coturnix,Coturnix ypsilophora,Brown Quail,,,McGowan 2010209,Birds,Galliformes,Phasianidae,Crossoptilon,Crossoptilon auritum,"Blue Eared-pheasant, Blue Eared Pheasant, Blue Eared-Pheasant",,,McGowan 2010210,Birds,Galliformes,Phasianidae,Crossoptilon,Crossoptilon crossoptilon,"White Eared-pheasant, White Eared Pheasant, White Eared-Pheasant",,,McGowan 2010211,Birds,Galliformes,Phasianidae,Crossoptilon,Crossoptilon harmani,"Tibetan Eared-pheasant, Tibetan Eared Pheasant, Tibetan Eared-Pheasant",,,McGowan 2010212,Birds,Galliformes,Phasianidae,Crossoptilon,Crossoptilon mantchuricum,"Brown Eared-pheasant, Brown Eared Pheasant, Brown Eared-Pheasant, Manchurian Eared-pheasant",,,McGowan 2010213,Birds,Galliformes,Phasianidae,Dendragapus,Dendragapus canadensis,Spruce Grouse,,,McGowan 2010214,Birds,Galliformes,Phasianidae,Dendragapus,Dendragapus falcipennis,Siberian Grouse,,,McGowan 2010215,Birds,Galliformes,Phasianidae,Dendragapus,Dendragapus fuliginosus,Sooty Grouse,,,McGowan 2010216,Birds,Galliformes,Phasianidae,Dendragapus,Dendragapus obscurus,Dusky Grouse,,,McGowan 2010217,Birds,Galliformes,Phasianidae,Francolinus,Francolinus adspersus,Red-billed Francolin,,,McGowan 2010218,Birds,Galliformes,Phasianidae,Francolinus,Francolinus afer,"Red-necked Francolin, Red-necked Spurfowl",,,McGowan 2010